{
  "type": "Page",
  "hideBorders": false,
  "title": "showCase page",
  "views": [
    {
      "oId": "oId:/views/plot1.json",
      "geometry": {
        "kind": "Relative",
        "x": 0,
        "y": 0,
        "w": 6,
        "h": 8
      },
      "windowState": "Normalized"
    },
    {
      "path": "/views/plot1.json",
      "geometry": {
        "kind": "Relative",
        "x": 7,
        "y": 0,
        "w": 6,
        "h": 8
      },
      "windowState": "Normalized"
    }
  ]
}
